nome,sigla,sigla_superior,unidade_organizacional,total_servidores
NÚCLEO DE APOIO AOS SERVIÇOS MÉDICOS E ODONTOLÓGICOS,NASMO-CZ,DDE-CZ,CAMPUS CAJAZEIRAS,3
Coordenação do Curso de Licenciatura em Letras EAD,CLaD-JP,UA4-JP,CAMPUS JOÃO PESSOA,4
PESQUISADOR INSTITUCIONAL - REITORIA,PI-RE,REITORIA,REITORIA,1
COORDENAÇÃO DE LICITAÇÕES-CAMPUS SOUSA,CLICITA-SS,DS-SS,CAMPUS SOUSA,1
DIRETORIA DE ADMINISTRAÇÃO DE MATERIAIS E RECURSOS PATRIMONIAIS - REITORIA,DAMRP-RE,PRAF-RE,REITORIA,6
COORDENAÇÃO DE GESTÃO DE PESSOAS - CAMPUS GUARABIRA,CGP-GB,DG-GB,CAMPUS GUARABIRA,2
COORDENAÇÃO DE TECNOLOGIA DA INFORMAÇÃO - CAMPUS GUARABIRA,CTI-GB,DG-GB,CAMPUS GUARABIRA,2
COORDENAÇÃO DE COMPRAS E LICITAÇÃO - CAMPUS GUARABIRA,CCL-GB,DAPF-GB,CAMPUS GUARABIRA,1
COORDENAÇÃO DE EXTENSÃO - CAMPUS GUARABIRA,COEX-GB,DG-GB,CAMPUS GUARABIRA,1
COORDENAÇÃO DE EXECUÇÃO ORÇAMENTÁRIA E FINANCEIRA - CAMPUS PRINCESA ISABEL,CEOF-PI,DAPF-PI,CAMPUS PRINCESA ISABEL,1
COORDENAÇÃO DE TECNOLOGIA DA INFORMAÇÃO - CAMPUS PRINCESA ISABEL,CTI-PI,DG-PI,CAMPUS PRINCESA ISABEL,2
COORDENAÇÃO DO CURSO TÉCNICO EM EDIFICAÇÕES  - CAMPUS PRINCESA ISABEL,CCTE-PI,DDE-PI,CAMPUS PRINCESA ISABEL,8
COORDENAÇÃO DO CURSO SUPERIOR EM LICENCIATURA  EM FÍSICA,CCLF-CG,DDE-CG,CAMPUS CAMPINA GRANDE,3
COORDENAÇÃO DO CURSO DE ANÁLISE E DESENVOLVIMENTO DE SISTEMAS - CAMPUS MONTEIRO,CCADS-MT,DDE-MT,CAMPUS MONTEIRO,7
Diretoria de Extensão Popular e Rural - Reitoria,DEXPR-RE,PROEXC-RE,REITORIA,2
COORDENAÇÃO DE REGISTRO E GERENCIAMENTO DE PROJETOS - REITORIA,CRGP-RE,DEXPR-RE,REITORIA,1
Diretoria de Extensão Tecnológica - Reitoria,DEXT-RE,PROEXC-RE,REITORIA,7
COORDENAÇÃO DE EXTENSÃO TECNOLÓGICA - REITORIA,CET-RE,DEXT-RE,REITORIA,1
COORDENAÇÃO DE ARQUIVO CENTRAL - CAMPUS JOÃO PESSOA,CAC-JP,DAA-JP ,CAMPUS JOÃO PESSOA,3
COORDENAÇÃO DE PESQUISA E INOVAÇÃO - CAMPUS MONTEIRO,CPESQI-MT,DDE-MT,CAMPUS MONTEIRO,1
COORDENAÇÃO DO CURSO SUPERIOR EM BACHARELADO EM ADMINISTRAÇÃO PÚBLICA - EAD - CAMPUS JOÃO PESSOA,CSAP-EAD-JP,UA5-JP,CAMPUS JOÃO PESSOA,2
COORDENAÇÃO DE EXTENSÃO -  CAMPUS MONTEIRO,COEXT-MT,DDE-MT,CAMPUS MONTEIRO,1
COORDENAÇÃO DE ESPECIALIZAÇÃO - CAMPUS MONTEIRO,COESP-MT,DDE-MT,CAMPUS MONTEIRO,1
COORDENAÇÃO DO CURSO TÉCNICO EM MANUTENÇÃO E SUPORTE EM INFORMÁTICA - CAMPUS MONTEIRO,CTMSI-MT,DDE-MT,CAMPUS MONTEIRO,3
COORDENAÇÃO DO CURSO TÉCNICO EM INSTRUMENTO MUSICAL - CAMPUS MONTEIRO,CCTIM-MT,DDE-MT,CAMPUS MONTEIRO,9
COORDENAÇÃO DE ALMOXARIFADO E PATRIMÔNIO - CAMPUS CAMPINA GRANDE,CAP-CG,DAPF-CG,CAMPUS CAMPINA GRANDE,6
COORDENAÇÃO  PEDAGÓGICA DE APOIO AO ESTUDANTE - CAMPUS PRINCESA ISABEL,COPAE-PI,DDE-PI,CAMPUS PRINCESA ISABEL,9
CONSELHO DIRETOR - CAMPUS CAMPINA GRANDE,CD-CG,CAMPUS-CG,CAMPUS CAMPINA GRANDE,1
COORDENAÇÃO DE EAD-CAMPUS SOUSA,CEAD-SS,DDE-SS,CAMPUS SOUSA,2
COORDENAÇÃO DO CURSO TÉCNICO DE SECRETARIADO - CAMPUS JP,CCTS-JP,UA5-JP,CAMPUS JOÃO PESSOA,1
COORDENAÇÃO DO CURSO TÉCNICO EM MANUTENÇAO EM SUPORTE EM INFORMÁTICA - CAMPUS PICUÍ,CCTMSI-PC,DDE-PC,CAMPUS PICUÍ,1
COORDENAÇÃO DO CURSO TÉCNICO EM EDIFICAÇÕES - CAMPUS PICUÍ,CCTE-PC,DDE-PC,CAMPUS PICUÍ,4
DEPARTAMENTO DE EDUCAÇÃO PROFISSIONAL - CAMPUS SOUSA,DEP-SS,DDE-SS,CAMPUS SOUSA,21
COORDENAÇÃO DO CURSO TECNICO EM AGROPECUARIA-CAMPUS SOUSA,CCTAGRO-SS,DEP-SS,CAMPUS SOUSA,3
COORDENAÇÃO DO CURSO TÉCNICO EM MEIO AMBIENTE INTEGRADO AO MÉDIO - CAMPUS SOUSA,CCTMA-SS,DEP-SS,CAMPUS SOUSA,1
COORDENAÇÃO DO CURSO TECNICO EM AGROINDUSTRIA-CAMPUS SOUSA,CCTA-SS,DEP-SS,CAMPUS SOUSA,2
COORDENAÇÃO DO CURSO TÉCNICO EM INFORMÁTICA - CAMPUS SOUSA,CCTI-SS,DEP-SS,CAMPUS SOUSA,2
COORDENAÇÃO PROEJA-CAMPUS SOUSA,CPROEJA-SS,DEP-SS,CAMPUS SOUSA,2
COORDENAÇÃO DO CURSO SUPERIOR DE BACHARELADO EM ENGENHARIA CIVIL - CAMPUS CAJAZEIRAS,CBEC-CZ,UNIND-CZ,CAMPUS CAJAZEIRAS,2
NÚCLEO DE ATENDIMENTO AS PESSOAS COM NECESSIDADES ESPECÍFICAS - CAMPUS SOUSA,NAPNE-SS,DAE-SS,CAMPUS SOUSA,1
COMISSÃO PERMANENTE DE SINDICÂNCIA PROCESSOS ADMINISTRATIVOS DISCIPLINAR - REITORIA,COPSPAD-RE,COMISSOES-RE,REITORIA,3
Arquivo Setorial Gestão de Pessoas,ASGP-RE,DGEP-RE,REITORIA,1
"COORDENAÇÃO DOS NÚCLEOS DE APRENDIZAGEM, MONITORIA E TUTORIA - CAMPUS CAMPINA GRANDE",NAPMT-CG,DDE-CG,CAMPUS CAMPINA GRANDE,1
COORDENAÇÃO DO CURSO DE LICENCIATURA EM EDUCAÇÃO FÍSICA - CAMPUS SOUSA,CCLEF-SS,DES-SS,CAMPUS SOUSA,6
COORDENAÇÃO DO CURSO TÉCNICO EM CONTROLE AMBIENTAL-  CAMPUS PRINCESA ISABEL,CCTCA-PI,DDE-PI,CAMPUS PRINCESA ISABEL,9
DEPARTAMENTO DE TECNOLOGIA DA INFORMAÇÃO E COMUNICAÇÃO-CAMPUS SOUSA,DTIC-SS,DAP-SS,CAMPUS SOUSA,6
COORDENAÇÃO DE DESENVOLVIMENTO PROFISSIONAL - CAMPUS JOÃO PESSOA,CDPROF-JP,DGDP-JP,CAMPUS JOÃO PESSOA,3
COORDENAÇÃO DE PROMOÇÃO SOCIAL E QUALIDADE DE VIDA - CAMPUS JOÃO PESSOA,CPSQV-JP,DGDP-JP,CAMPUS JOÃO PESSOA,4
AUDITORIA  - CAMPUS CAJAZEIRAS,AUDITORIA-CZ,CAMPUS-CZ,CAMPUS CAJAZEIRAS,2
COORDENAÇÃO DO CURSO SUPERIOR DE TECNOLOGIA EM GESTÃO E COMÉRCIO - CAMPUS GUARABIRA,CSTGC-GB,DDE-GB,CAMPUS GUARABIRA,2
COORDENAÇÃO DO CURSO TÉCNICO EM CONTABILIDADE - CAMPUS GUARABIRA,COTCON-GB,DDE-GB,CAMPUS GUARABIRA,1
COORDENAÇÃO DO CURSO TÉCNICO EM INFORMÁTICA - CAMPUS GUARABIRA,COTINF-GB,DDE-GB,CAMPUS GUARABIRA,2
COORDENAÇÃO DO CURSO TÉCNICO INTEGRADO EM EDIFICAÇÕES - CAMPUS GUARABIRA,COEDIF-GB,DDE-GB,CAMPUS GUARABIRA,2
CAMPUS AVANÇADO PEDRAS DE FOGO,CPF-PF,REITORIA,REITORIA,9
COORDENAÇÃO DE EXTENSÃO - CAMPUS CAJAZEIRAS,CE-CZ,DG-CZ,CAMPUS CAJAZEIRAS,1
COORDENAÇÃO DE ALMOXARIFADO - CAMPUS CAJAZEIRAS,ALMOXARIFADO-CZ,DAPF-CZ,CAMPUS CAJAZEIRAS,1
COORDENAÇÃO DE DIÁRIAS E PASSAGENS - CAMPUS CAJAZEIRAS,SCDP-CZ,DAPF-CZ,CAMPUS CAJAZEIRAS,1
COORDENAÇÃO DE RECURSOS AUDIOVISUAIS - CAMPUS CAJAZEIRAS,CRA-CZ,DDE-CZ,CAMPUS CAJAZEIRAS,2
COORDENAÇÃO DO PROEJA - CAMPUS CAJAZEIRAS,PROEJA-CZ,DDE-CZ,CAMPUS CAJAZEIRAS,1
"DIRETORIA DE COMPRAS, CONTRATOS E LICITAÇÕES - REITORIA",DCCL-RE,PRAF-RE,REITORIA,8
DIRETORIA DE ORÇAMENTO - REITORIA,DOR-RE,PRAF-RE,REITORIA,5
COORDENAÇÃO DE FISCALIZAÇÃO DE CONTRATOS - REITORIA,CFC-RE,DCCL-RE,REITORIA,1
COORDENAÇÃO DE MATEMÁTICA E SUAS TECNOLOGIAS - UA04 - CAMPUS JOÃO PESSOA,CMT-JP,UA4-JP,CAMPUS JOÃO PESSOA,1
COORDENAÇÃO DO PROEJA - CAMPUS CABEDELO,PROEJA-CB,DDE-CB,CAMPUS CABEDELO,1
COORDENAÇÃO DE APOIO ACADÊMICO - CAMPUS CAMPINA GRANDE,CAA-CG,DDE-CG,CAMPUS CAMPINA GRANDE,4
POLO DE EDUCAÇÃO A DISTÂNCIA - CAMPUS  CAMPINA GRANDE,PEAD-CG,DDE-CG,CAMPUS CAMPINA GRANDE,1
COORDENAÇÃO DE ADMINISTRAÇÃO DE PESSOAL - CAMPUS JP ,CAP-JP,DGDP-JP,CAMPUS JOÃO PESSOA,4
DIRETORIA DE LEGISLAÇÃO E ADMINISTRAÇÃO DE PESSOAL - REITORIA,DLAP-RE,DGEP-RE,REITORIA,8
NÚCLEO DE APOIO ÀS PESSOAS COM NECESSIDADES ESPECIAIS - CAMPUS MONTEIRO,NAPNE-MT,DDE-MT,CAMPUS MONTEIRO,1
NÚCLEO DOCUMENTAÇÃO PESQUISA - REITORIA,NDPEP-RE,REITORIA,REITORIA,5
COORDENAÇÃO DE ASSUNTOS ESTUDANTIS - RE,CAEST-RE,PRAE-RE,REITORIA,2
COORDENAÇÃO DE DOCUMENTAÇÃO E ACOMPANHAMENTO DE EDITAIS DA PRE - REITORIA,CDAE-RE,PRE-RE,REITORIA,1
DIVISÃO DE PLANEJAMENTO E EXECUÇÃO DE AUDITORIA - REITORIA,AUDI-PE-RE,AUDI-GE-RE,REITORIA,6
COORDENAÇÃO DE TURNO - CAMPUS MONTEIRO,CT-MT,DDE-MT,CAMPUS MONTEIRO,3
DEPARTAMENTO DE ENSINO SUPERIOR  -CAMPUS CG,DES-CG,DDE-CG,CAMPUS CAMPINA GRANDE,1
DEPARTAMENTO DE ENSINO TÉCNICO - CAMPUS CG,DET-CG,DDE-CG,CAMPUS CAMPINA GRANDE,1
COORDENAÇÃO DE GOVERNANÇA E RELACIONAMENTO DE TI - REITORIA,CGOVTI-RE,DGTI-RE,REITORIA,1
COORDENAÇÃO DE SUPORTE TÉCNICO - REITORIA,CST-RE,DGTI-RE,REITORIA,4
COORDENAÇÃO DE PESQUISA - CAMPUS CAMPINA GRANDE,CP-CG,DDE-CG,CAMPUS CAMPINA GRANDE,1
COORDENAÇÃO DE ASSISTÊNCIA À SAÚDE - CAMPUS CG,CAS-CG,DG-CG,CAMPUS CAMPINA GRANDE,8
NÚCLEO DE ATENDIMENTO AS PESSOAS COM NECESSIDADES ESPECÍFICAS - CAMPUS CABEDELO,NAPNE-CB,DDE-CB,CAMPUS CABEDELO,2
COORDENAÇÃO DE EXTENSÃO - CAMPUS PICUÍ,COEXT-PC,DG-PC,CAMPUS PICUÍ,1
COORDENAÇÃO DE MATEMÁTICA E SUAS TECNOLOGIAS - CAMPUS CAMPINA GRANDE,CMT-CG,DDE-CG,CAMPUS CAMPINA GRANDE,14
COORDENAÇÃO DE CIÊNCIAS EXATAS E DA NATUREZA - CAMPUS CAMPINA GRANDE,CCEN-CG,DDE-CG,CAMPUS CAMPINA GRANDE,20
COORDENAÇÃO DE LINGUAGENS E CÓDIGOS - CAMPUS CAMPINA GRANDE ,CLC-CG,DDE-CG,CAMPUS CAMPINA GRANDE,14
COORDENAÇÃO DE EDUCAÇÃO FÍSICA E DESPORTOS - CAMPUS CAMPINA GRANDE,CEFD-CG,DDE-CG,CAMPUS CAMPINA GRANDE,5
COORDENAÇÃO DE CIÊNCIAS HUMANAS - CAMPUS CAMPINA GRANDE,CCH-CG,DDE-CG,CAMPUS CAMPINA GRANDE,15
COORDENAÇÃO DE EDUCAÇÃO À DISTANCIA  -  CAMPUS CABEDELO,CEAD-CB,DDE-CB,CAMPUS CABEDELO,1
 COORDENAÇÃO DE FORMAÇÃO GERAL E PROJETOS ESPECIAIS -  CAMPUS MONTEIRO,CFG-MT,DDE-MT,CAMPUS MONTEIRO,15
COORDENAÇÃO DE INOVAÇÃO - CAMPUS JOÃO PESSOA,CINOV-JP,DIPPED-JP,CAMPUS JOÃO PESSOA,1
COORDENAÇÃO DO NÚCLEO DE FORMAÇÃO GERAL - CAMPUS GUARABIRA,CNFG-GB,DDE-GB,CAMPUS GUARABIRA,2
DEPARTAMENTO DE BIBLIOTECAS - REITORIA,DBIBLIO-RE,PRE-RE,REITORIA,2
COORDENAÇÃO DO CURSO SUPERIOR EM LICENCIATURA EM COMPUTAÇÃO E INFORMÁTICA - CAMPUS CAJAZEIRAS,CLICCOMP-CZ,UNINFO-CZ,CAMPUS CAJAZEIRAS,1
COORDENAÇÃO DE PATRIMÔNIO E ALMOXARIFADO - CAMPUS PRINCESA ISABEL,CPA-PI,DAPF-PI,CAMPUS PRINCESA ISABEL,1
COORDENAÇÃO DE LABORATÓRIOS - CAMPUS PRINCESA ISABEL, COLAB-PI,DDE-PI,CAMPUS PRINCESA ISABEL,3
DIRETORIA DO CAMPUS AVANÇADO CABEDELO CENTRO - REITORIA,DCACC-RE,REITORIA,REITORIA,47
COORDENAÇÃO DE EXTENSÃO - CAMPUS PATOS,CE-PT,DG-PT ,CAMPUS PATOS,1
COORDENAÇÃO DE FORMAÇÃO GERAL E PROJETOS ESPECIAIS  - CAMPUS PATOS,CFGPE-PT,DDE-PT,CAMPUS PATOS,26
COORDENAÇÃO DE FORMAÇÃO GERAL E PROJETOS ESPECIAIS  - CAMPUS PICUÍ,CFGPE-PC,DDE-PC,CAMPUS PICUÍ,27
SECRETARIA PRO-REITORIA DE EXTENSAO-RE,SECEXT-RE,PROEXC-RE,REITORIA,1
COORDENAÇÃO GERAL DE ENSINO - CAMPUS PRINCESA ISABEL,CGE-PI,DDE-PI,CAMPUS PRINCESA ISABEL,1
COMISSÕES - REITORIA,COMISSOES-RE,REITORIA,REITORIA,4
DIRETORIA DO  CAMPUS AVANÇADO AREIA - REITORIA,DCAAREIA-RE,REITORIA,REITORIA,13
DEPARTAMENTO ARTICULAÇÃO PEDAGÓGICA - CAMPUS JOÃO PESSOA,DEPAP-JP,DDE-JP,CAMPUS JOÃO PESSOA,13
COORDENAÇÃO ADMINISTRATIVA CAMPUS AVANÇADO CABEDELO CENTRO-REITORIA,COADAV-RE,DCACC-RE,REITORIA,3
COORDENAÇÃO DE ENSINO CAMPUS AVANÇADO CABEDELO CENTRO - REITORIA,COEN-CC-RE,DCACC-RE,REITORIA,15
CAMPUS CABEDELO CENTRO,CAMPUS-CC,REITORIA,REITORIA,1
COORDENAÇÃO DO CURSO TÉCNICO EM GEOLOGIA - CAMPUS PICUÍ,CCTG-PC,DDE-PC,CAMPUS PICUÍ,3
COORDENAÇÃO DE CAPACITAÇÃO E QUALIFICAÇÃO - CAMPUS CG,COCAQ-CG,DG-CG,CAMPUS CAMPINA GRANDE,1
COORDENAÇÃO DE  ALMOXARIFADO PATRIMÔNIO - CAMPUS GUARABIRA,COALP-GB,DAPF-GB,CAMPUS GUARABIRA,1
PRO-REITORIA ASSUNTOS ESTUDANTIS - REITORIA,PRAE-RE,REITORIA,REITORIA,13
COORDENAÇÃO DO CURSO SUPERIOR DE LICENCIATURA EM CIÊNCIAS BIOLÓGICAS - CAMPUS CABEDELO,CSLCB-CB,DDE-CB,CAMPUS CABEDELO,10
COORDENAÇÃO DE TRANSFERÊNCIA DE TECNOLOGIA - REITORIA,CTT-RE,DIT-RE,REITORIA,1
COORDENAÇÃO DE  PÓS GRADUAÇÃO LATO SENSU - REITORIA,COPGLAT-RE,DPG-RE,REITORIA,1
COORDENAÇÃO PEDAGÓGICA DE APOIO AO ESTUDANTE - CAMPUS GUARABIRA,COPAE-GB,DDE-GB,CAMPUS GUARABIRA,2
Coordenacao de Logistica da PRAP-RE,COLOG-RE,DCML-RE,REITORIA,1
COORDENAÇÃO CURSO ENGENHARIA COMPUTACAO-CG,CCEC-CG,COAIN-CG,CAMPUS CAMPINA GRANDE,1
COORDENAÇÃO DE LICITAÇÕES - CAMPUS MONTEIRO,CL-MT,DAPF-MT,CAMPUS MONTEIRO,2
COORDENAÇÃO DE  ENSINO PROFISSIONAL MARITIMO - REITORIA,CEPM-CC-RE,DCACC-RE,REITORIA,3
DIRETORIA DE APOIO AOS ORGÃOS COLEGIADOS - REITORIA,DAAOC-RE,REITORIA,REITORIA,3
DIRETORIA GERAL COMUNICACAO MARKETING-RE,DGCOM-RE,REITORIA,REITORIA,9
"COORDENAÇÃO DE EXTENSÃO, CULTURA E DESAFIOS ACADÊMICOS - CAMPUS JOÃO PESSOA",CEXC-JP,DIPPED-JP,CAMPUS JOÃO PESSOA,3
COORDENAÇÃO DO CURSO TECNICO EM PESCA CAMPUS AVANÇADO CABEDELO CENTRO,CTPE-CC-RE,DCACC-RE,REITORIA,1
NÚCLEO ESPECIALIZADO EM LIBRAS - CAMPUS JOÃO PESSOA,NEL-JP,COAPNE-JP,CAMPUS JOÃO PESSOA,3
COORDENAÇÃO DE ACOLHIMENTO AO ESTUDANTE - CAMPUS JOÃO PESSOA,CAE-JP,DAEST-JP,CAMPUS JOÃO PESSOA,4
NÚCLEO DE ATENDIMENTO EDUCACIONAL ESPECIALIZADO - CAMPUS JOÃO PESSOA,NAEE-JP,COAPNE-JP,CAMPUS JOÃO PESSOA,1
COORDENAÇÃO DE PÓS-GRADUAÇÃO - CAMPUS PATOS,CPOG-PT,DDE-PT,CAMPUS PATOS,1
DIRETORIA GERAL - CAMPUS MANGABEIRA - REITORIA,DG-MB-RE,REITORIA,REITORIA,16
COORDENAÇÃO DE ENSINO - CAMPUS MANGABEIRA - REITORIA,CE-MB-RE,DG-MB-RE,REITORIA,13
COORDENAÇÃO DE CONTROLE ACADÊMICO - CAMPUS MANGABEIRA - REITORIA,CCA-MB-RE,CE-MB-RE,REITORIA,2
COORDENAÇÃO DO CURSO TÉCNICO EM CUIDADOS DE IDOSOS - CAMPUS MANGABEIRA - REITORIA,CCI-MB-RE,CE-MB-RE,REITORIA,6
COORDENAÇÃO DE ESTÁGIO - REITORIA,CEST-RE,PRE-RE,REITORIA,6
DIRETORIA DO CAMPUS AVANÇADO SOLEDADE - REITORIA,DCSOL-SD-RE,REITORIA,REITORIA,11
COORDENAÇÃO DE  ASSISTÊNCIA ESTUDANTIL - MT,CAEST-MT,DDE-MT,CAMPUS MONTEIRO,3
COORDENAÇÃO DE EXECUÇÃO ORÇAMENTÁRIA E FINANCEIRA - CAMPUS GUARABIRA,CEOF-GB,DAPF-GB,CAMPUS GUARABIRA,1
COORDENAÇÃO DO CURSO TÉCNICO INFORMÁTICA - CAMPUS PICUÍ,CCTI-PC,DDE-PC,CAMPUS PICUÍ,5
COORDENAÇÃO DE GESTÃO RECURSOS AMBIENTAIS SEMIÁRIDO - CAMPUS PICUÍ,CGRAS-PC,DDE-PC,CAMPUS PICUÍ,1
COORDENAÇÃO DO GABINETE MÉDICO ODONTOLÓGICO - CAMPUS CG,CGMO-CG ,DDE-CG,CAMPUS CAMPINA GRANDE,2
COORDENAÇÃO DO CURSO DE SERVICOS JURIDICOS DO CAMPUS AVANÇADO CABEDELO CENTRO,CSEJ-CC-RE,DCACC-RE,REITORIA,7
COORDENAÇÃO DE EXTENSÃO DO CAMPUS CABEDELO CENTRO,COEXT-CC-RE,DCACC-RE,REITORIA,2
COORDENAÇÃO DO CURSO TÉCNICO DE TRANSPORTE AQUAVIÁRIO DO CAMPUS CABEDELO CENTRO,TTAQ-CC,DCACC-RE,REITORIA,6
COORDENAÇÃO DO CURSO TÉCNICO EXPERIMENTAL EM NAÚTICA DO CAMPUS AVANÇADO CABEDELO CENTRO,CEXN-CC,DCACC-RE,REITORIA,1
EDITORA DO IFPB,EDIT-RE,PRPIPG-RE,REITORIA,3
COORD EDITORACAO GRAFICA-RE,COEG-RE,EDIT-RE,REITORIA,1
COORDENAÇÃO DE  ESTÁGIO - GUARABIRA,CE-GB,DDE-GB,CAMPUS GUARABIRA,2
COORDENAÇÃO DE COMPRAS E RELACIONAMENTO COM FORNECEDOR - SS,CCRF-SS,DS-SS,CAMPUS SOUSA,2
COORDENAÇÃO DE PÓS-GRADUAÇÃO E PESQUISA - CAMPUS JOÃO PESSOA,CPGPESQ-JP,DIPPED-JP,CAMPUS JOÃO PESSOA,1
COORD. SISTEMAS DE INFORMAÇÃO-COMPEC-RE,COSINF-RE,COMPEC-RE,REITORIA,1
Assessoria de Comunicação,ASCOM-CG,DG-CG,CAMPUS CAMPINA GRANDE,2
DEPARTAMENTO DE EDUCACAO SUPERIOR-SS,DES-SS,DDE-SS,CAMPUS SOUSA,37
COORDENAÇÃO DO HOSPITAL VETERINARIO-SS,CHV-SS,DES-SS,CAMPUS SOUSA,9
DIRETORIA DE EDUCAÇÃO FÍSICA E ESPORTES - REITORIA,DEFE-RE,PRAE-RE,REITORIA,1
COORDENAÇÃO DE PÓS-GRADUAÇÃO - CAMPUS JOÃO PESSOA,COPG-JP,DIPPED-JP,CAMPUS JOÃO PESSOA,2
DEPARTAMENTO DE GESTÃO E DESENVOLVIMENTO DE PESSOAS - CAMPUS SOUSA,DGDP-SS,DAP-SS,CAMPUS SOUSA,4
CAMPUS SANTA RITA,CAMPUS-SR,REITORIA,CAMPUS SANTA RITA,48
DIREÇÃO GERAL - CAMPUS SANTA RITA,DG-SR,CAMPUS-SR,CAMPUS SANTA RITA,48
DIRETORIA DE DESENVOLVIMENTO DO ENSINO DO CAMPUS SANTA RITA,DDE-SR,DG-SR,CAMPUS SANTA RITA,37
"DIRETORIA DE ADMINISTRÇÃO, PLANEJAMENTO E FINANÇAS DO CAMPUS SANTA RITA",DAPF-SR,DG-SR,CAMPUS SANTA RITA,7
COORDENAÇÃO DE PATRIMÔNIO E ARQUIVO - CAMPUS SANTA RITA,CPARQ-SR,DAPF-SR,CAMPUS SANTA RITA,1
COORDENAÇÃO CURSO INTEGRADO DE MEIO AMBIENTE - CAMPUS SANTA RITA,CINTMAM-SR,DDE-SR,CAMPUS SANTA RITA,2
COORDENAÇÃO DE CONTROLE ACADÊMICO - CAMPUS SANTA RITA,CCA-SR,DDE-SR,CAMPUS SANTA RITA,2
COORDENAÇÃO DE GESTÃO DE PESSOAS - CAMPUS SANTA RITA,CGP-SR,DAPF-SR,CAMPUS SANTA RITA,1
COORDENAÇÃO DE COMUNICACAO E TEC INFORMACAO - CAMPUS SANTA RITA,CCTIN-SR,DAPF-SR,CAMPUS SANTA RITA,2
CAMPUS ESPERANÇA,CAMPUS-ES,REITORIA,CAMPUS ESPERANÇA,47
DIREÇÃO GERAL - CAMPUS ESPERANÇA,DG-ES,CAMPUS-ES,CAMPUS ESPERANÇA,47
DIRETORIA DE DESENVOLVIMENTO E ENSINO - CAMPUS ESPERANÇA,DDE-ES,DG-ES,CAMPUS ESPERANÇA,32
"DIRETORIA DE ADMINISTRAÇÃO, PLANEJAMENTO E FINANÇAS - CAMPUS ESPERANÇA",DAPF-ES,DG-ES,CAMPUS ESPERANÇA,11
COORDENAÇÃO TÉCNICO INFORMÁTICA - CAMPUS ESPERANÇA,CTIN-ES,DDE-ES,CAMPUS ESPERANÇA,7
COORDENAÇÃO DE PATRIMÔNIO E ALMOXARIFADO - CAMPUS ESPERANÇA,CPAL-ES,DAPF-ES,CAMPUS ESPERANÇA,1
COORDENAÇÃO FORMAÇÃO GERAL - CAMPUS ESPERANÇA,CFOG-ES,DDE-ES,CAMPUS ESPERANÇA,11
COORDENADOR FINANCAS - CAMPUS ESPERANÇA,COF-ES,DAPF-ES,CAMPUS ESPERANÇA,1
COORDENAÇÃO DE GESTÃO DE PESSOAS - CAMPUS ESPERANÇA,CGP-ES,DG-ES,CAMPUS ESPERANÇA,1
COORDENAÇÃO PESQUISA EXTENSÃO - CAMPUS ESPERANÇA,CPEX-ES,DG-ES,CAMPUS ESPERANÇA,2
COORDENAÇÃO DO CURSO TÉCNICO EM INFORMÁTICA INTEGRADO AO MÉDIO - CAMPUS PATOS,CCIIEM-PT,DDE-PT,CAMPUS PATOS,2
DIRETORIA GERAL - CAMPUS ITABAIANA,DG-IB,CAMPUS-IB,CAMPUS ITABAIANA,49
DIRETORIA DE DESENVOLVIMENTO E ENSINO - CAMPUS ITABAIANA,DDE-IB,DG-IB,CAMPUS ITABAIANA,35
"DIRETORIA DE ADMINISTRAÇÃO, PLANEJAMENTO E FINANÇAS - CAMPUS ITABAIANA",DAPF-IB,DG-IB,CAMPUS ITABAIANA,8
CAMPUS ITABAIANA,CAMPUS-IB,REITORIA,CAMPUS ITABAIANA,49
"COORDENACAO DE ADMINISTRACAO, LOGISTICA E MANUTENCAO - CAMPUS ITABAIANA",CALM-IB,DAPF-IB,CAMPUS ITABAIANA,2
COORDENAÇÃO DO CURSO DE AUTOMAÇÃO INDUSTRIAL - CAMPUS ITABAIANA,CAI-IB,DDE-IB,CAMPUS ITABAIANA,10
DIRETORIA DE PLANEJAMENTO E GESTAO DAS POLITICAS ESTUDANTIS - REITORIA,DPGEST-RE,PRAE-RE,REITORIA,2
COORDENAÇÃO DO CURSO DE ELETROMECÂNICA - CAMPUS ITABAIANA,COELM-IB,DDE-IB,CAMPUS ITABAIANA,14
COORDENACAO PEDAGOGICA E ASSISTENCIA ESTUDANTIL - CAMPUS ITABAIANA,CPAE-IB,DDE-IB,CAMPUS ITABAIANA,2
CAMPUS CATOLÉ DO ROCHA,CAMPUS-CR,REITORIA,CAMPUS CATOLÉ DO ROCHA,45
DIRETORIA GERAL - CAMPUS CATOLÉ DO ROCHA,DG-CR,CAMPUS-CR,CAMPUS CATOLÉ DO ROCHA,45
DIRETORIA DE DESENVOLVIMENTO E ENSINO - CAMPUS CATOLÉ DO ROCHA,DDE-CR,DG-CR,CAMPUS CATOLÉ DO ROCHA,34
"DIRETORIA DE ADMINISTRAÇÃO, PLANEJAMENTO E FINANÇAS - CAMPUS CATOLÉ DO ROCHA",DAPF-CR,DG-CR,CAMPUS CATOLÉ DO ROCHA,10
COORDENAÇÃO DE COMPRAS E LICITAÇÃO - CATOLÉ DO ROCHA,CCL-CR,DAPF-CR,CAMPUS CATOLÉ DO ROCHA,1
COORDENAÇÃO DE CONTROLE ACADÊMICO - CATOLÉ DO ROCHA,CCA-CR,DDE-CR,CAMPUS CATOLÉ DO ROCHA,1
COORDENAÇÃO DE ORÇAMENTO E PLANEJAMENTO - CAMPUS CATOLÉ DO ROCHA,COPLAN-CR,DAPF-CR,CAMPUS CATOLÉ DO ROCHA,1
COORDENAÇÃO DE GESTÃO DE PESSOAS - CATOLÉ DO ROCHA,CGP-CR,DAPF-CR,CAMPUS CATOLÉ DO ROCHA,1
COORDENAÇÃO DO CURSO DE EDIFICAÇÕES - CATOLÉ DO ROCHA,COEDIF-CR,DDE-CR,CAMPUS CATOLÉ DO ROCHA,1
COORDENAÇÃO GESTORA SETORIAL SCDP - CATOLÉ DO ROCHA,COGSS-CR,DAPF-CR,CAMPUS CATOLÉ DO ROCHA,1
"COORDENAÇÃO DE PESQUISA, INOVAÇÃO E ESTÁGIO - CAMPUS CATOLÉ DO ROCHA",COPIE-CR,DDE-CR,CAMPUS CATOLÉ DO ROCHA,1
Coordenação do Curso Técnico em Química - Campus Cabedelo,CTQUIM-CB,DDE-CB,CAMPUS CABEDELO,9
Coordenação do Curso Técnico em Multimídia - Campus Cabedelo,CTMULT-CB,DDE-CB,CAMPUS CABEDELO,2
CAMPUS ITAPORANGA,CAMPUS-IP,REITORIA,CAMPUS ITAPORANGA,44
DIRETORIA GERAL - CAMPUS ITAPORANGA,DG-IP,CAMPUS-IP,CAMPUS ITAPORANGA,44
"DIRETORIA DE ADMINISTRAÇÃO, PLANEJAMENTO E FINANÇAS - CAMPUS ITAPORANGA",DAPF-IP,DG-IP,CAMPUS ITAPORANGA,7
DIRETORIA DE DESENVOLVIMENTO E ENSINO - CAMPUS ITAPORANGA,DDE-IP,DG-IP,CAMPUS ITAPORANGA,32
COORDENACAO DO CURSO TÉCNICO INTEGRADO EM EDIFICAÇÕES - CAMPUS ITAPORANGA,CCTE-IP,DDE-IP,CAMPUS ITAPORANGA,3
COORDENAÇÃO PEDAGÓGICA - CAMPUS  ITAPORANGA,COPED-IP,DDE-IP,CAMPUS ITAPORANGA,2
COORDENACAO DE PESQUISA E EXTENSAO - CAMPUS ITAPORANGA,CPEXITP-IP,DDE-IP,CAMPUS ITAPORANGA,1
COORDENAÇÃO DE DESENVOLVIMENTO E ENSINO - IP,CDDE-IP,DDE-IP,CAMPUS ITAPORANGA,9
COORDENACAO DE ALMOXARIFADO E PATRIMONIO - CAMPUS ITAPORANGA,COAP-IP,DAPF-IP,CAMPUS ITAPORANGA,2
CURSO TÉCNICO EM EDIFICAÇÕES DO CAMPUS MONTEIRO,CTEDIF-MT,DDE-MT,CAMPUS MONTEIRO,2
COORDENAÇÃO DE ÁREA DE INFORMÁTICA - CAMPUS CAMPINA GRANDE,COAIN-CG,DDE-CG,CAMPUS CAMPINA GRANDE,32
COORDENAÇÃO CURSO TÉCNICO INTEGRADO DE INFORMÁTICA - CAMPUS SANTA RITA,CINF-SR,DDE-SR,CAMPUS SANTA RITA,5
COORDENAÇÃO DE CONTROLE E EXPEDIÇÃO DE DIÁRIAS - CAMPUS ESPERANÇA,CCED-ES,DAPF-ES,CAMPUS ESPERANÇA,2
COORDENAÇÃO DE ESTÁGIO - CAMPUS ESPERANÇA,CE-ES,DDE-ES,CAMPUS ESPERANÇA,1
COORDENAÇÃO PEDAGÓGICA E DE APOIO AO ESTUDANTE - CAMPUS ESPERANÇA,COPAE-ES,DDE-ES,CAMPUS ESPERANÇA,4
COORDENAÇÃO CURSO TÉCNICO EM GUIA DE TURISMO - CAMPUS CABEDELO CENTRO,CTGT-CC,DCACC-RE,REITORIA,1
COORDENAÇÃO DE CONTROLE ACADÊMICO - CAMPUS ESPERANÇA,CCA-ES,DDE-ES,CAMPUS ESPERANÇA,1
GABINETE MÉDICO ODONTOLÓGICO - CAMPUS CABEDELO,GABMED-CB,DDE-CB,CAMPUS CABEDELO,2
GABINETE MÉDICO - CAMPUS PATOS,GABM-PT,DDE-PT,CAMPUS PATOS,2
COORDENAÇÃO EXECUTIVA DE LEGISLAÇÃO E ADMINISTRAÇÃO DE PESSOAL,CLAP-RE,DLAP-RE,REITORIA,3
COORDENAÇÃO DE LABORATÓRIOS - CAMPUS PATOS,COLAB-PT,DDE-PT,CAMPUS PATOS,10
COORDENAÇÃO COMPRAS LICITAÇÕES - CAMPUS PATOS,COLIC-PT,DAPF-PT,CAMPUS PATOS,3
Coordenação do Curso Tecnico Integrado em Edificações - Campus Campina Grande,CTIED-CG,DDE-CG,CAMPUS CAMPINA GRANDE,2
COORDENAÇÃO DE ASSISTÊNCIA ESTUDANTIL - CAMPUS CATOLÉ DO ROCHA,CAEST-CR,DDE-CR,CAMPUS CATOLÉ DO ROCHA,2
NAPNE - NÚCLEO DE ASSISTÊNCIA ÀS PESSOAS COM NECESSIDADES ESPECÍFICAS - CÂMPUS PATOS,NAPNE-PT,DDE-PT,CAMPUS PATOS,3
COORDENACAO PEDAGOGICA E ASSISTENCIA ESTUDANTIL - CAMPUS CABEDELO CENTRO,COPAE-CC-RE,DCACC-RE,REITORIA,4
COORDENAÇÃO DE GESTÃO DE PESSOAS - CAMPUS ITAPORANGA,CGP-IP,DG-IP,CAMPUS ITAPORANGA,1
COORDENAÇÃO DE PROTOCOLO - CAMPUS CATOLÉ DO ROCHA,PROTOCOLO-CR,DAPF-CR,CAMPUS CATOLÉ DO ROCHA,1
Coordenação do Curso Técnico em Transações Imobiliárias - Campus Cabedelo Centro,CCTTI-CC,DCACC-RE,REITORIA,2
Coordenação do Curso de Especialização em Gestão Ambiental de Municípios - Campus Princesa Isabel,CGAM-PI,DDE-PI,CAMPUS PRINCESA ISABEL,5
COORDENAÇÃO DE COMPETIÇÕES ACADÊMICAS - CAMPUS JOÃO PESSOA,COCA-JP,DIPPED-JP,CAMPUS JOÃO PESSOA,1
Mestrado Profissional em Educação Profissional e Tecnológica - Campus João Pessoa,PROFEPT-JP,UA4-JP,CAMPUS JOÃO PESSOA,1
COORDENACAO DE APOIO A SISTEMAS INFORMATIZADOS-RE,CASI-RE,DGTI-RE,REITORIA,4
COORDENAÇÃO DO CURSO TÉCNICO EM RESTAURANTE E BAR,CCTRB-AR,DCAAREIA-RE,REITORIA,2
COORDENAÇÃO DE COMPRAS E LICITAÇÕES - CAMPUS ESPERANÇA,CCL-ES,DAPF-ES,CAMPUS ESPERANÇA,2
COORD CURSO TÉC. INFORMÁTICA INTEGRADO AO ENSINO MÉDIO - CAMPUS JOÃO PESSOA,CCTI-JP,UA2-JP,CAMPUS JOÃO PESSOA,1
COORDENAÇÃO DE PLANEJAMENTO - CAMPUS JOÃO PESSOA,COPLAN-JP,DG-JP,CAMPUS JOÃO PESSOA,3
COMISSÃO DE ÉTICA NO USO DE ANIMAIS - CAMPUS SOUSA,CEUA-SS,DES-SS,CAMPUS SOUSA,2
COORDENACAO DE LICITAÇÃO DE BENS E SERVICOS - REITORIA,CLBS-RE,DCCL-RE,REITORIA,1
COORDENAÇÃO DE BIBLIOTECA - CAMPUS CATOLÉ DO ROCHA,BIBLIOTECA-CR,DDE-CR,CAMPUS CATOLÉ DO ROCHA,1
COORDENAÇÃO DE CONTROLE ACADÊMICO - CAMPUS CABEDELO CENTRO - REITORIA,CCA-CC-RE,COEN-CC-RE,REITORIA,2
COORD ASSUNTOS EDUCACIONAIS-RE,COAED-RE,DES-RE,REITORIA,1
COORDENAÇÃO DE TECNOLOGIA DA INFORMAÇÃO - CAMPUS ESPERANÇA,CTI-ES,DAPF-ES,CAMPUS ESPERANÇA,4
COORD APOIO LABORATORIOS INFORMATICA-CG,CALIN-CG,DDE-CG,CAMPUS CAMPINA GRANDE,4
COORDENAÇÃO DE ASSISTÊNCIA ESTUDANTIL - CAMPUS ITAPORANGA,CAEST-IP,DDE-IP,CAMPUS ITAPORANGA,2
NÚCLEO DE ATENDIMENTO ÀS PESSOAS COM NECESSIDADES EDUCACIONAIS ESPECÍFICAS - CAMPUS ITAPORANGA,NAPNE-IP,DDE-IP,CAMPUS ITAPORANGA,1
Diretoria de Cultura - Reitoria,DCULT-RE,PROEXC-RE,REITORIA,2
COORDENAÇÃO DOS CURSOS DE LICENCIATURA - REITORIA,CLI-RE,DES-RE,REITORIA,1
Coordenação de Extensão e Cultura - Campus Catolé do Rocha,CEXTCULT-CR,DDE-CR,CAMPUS CATOLÉ DO ROCHA,1
COOR. DO MESTRADO PROF. EM PROPRIEDADE INTELECTUAL E TRANSFERÊNCIA DE TECNOLOGIA PARA INOVACAO,CPROFNIT-CG,DDE-CG,CAMPUS CAMPINA GRANDE,2
COORD CURSO ESPECIALIZAÇÃO EM MATEMÁTICA,CCEM-CZ,CP-CZ,CAMPUS CAJAZEIRAS,2
COORDENAÇÃO DE EXECUÇÃO ORÇAMENTÁRIA E FINANCEIRA - CAMPUS ITAPORANGA,CEOF-IP,DAPF-IP,CAMPUS ITAPORANGA,2
NÚCLEO DE SISTEMAS ADMINISTRATIVOS,NSADM-RE,DGTI-RE,REITORIA,4
COORDENAÇÃO DE PROTOCOLO - CAMPUS ITAPORANGA,PROTOCOLO-IP,DAPF-IP,CAMPUS ITAPORANGA,1
COORDENAÇÃO DE PESQUISA E INOVAÇÃO TECNOLÓGICA - CAMPUS SANTA RITA,CPIT-SR,DG-SR,CAMPUS SANTA RITA,2
COORDENAÇÃO DE EXTENSÃO - CAMPUS SANTA RITA,COEXT-SR,DG-SR,CAMPUS SANTA RITA,1
COORDENAÇÃO DE APOIO AO ESTUDANTE - CAMPUS SANTA RITA,CAEST-SR,DDE-SR,CAMPUS SANTA RITA,2
COORDENAÇÃO PEDAGÓGICA - CAMPUS SANTA RITA,COPED-SR,DDE-SR,CAMPUS SANTA RITA,1
NÚCLEO DE ATEND. ÀS PESSOAS COM NECESSIDADES. EDUCAC. ESPECIAIS - CAMPUS SANTA RITA,NAPNE-SR,DDE-SR,CAMPUS SANTA RITA,3
COORDENAÇÃO DE PLANEJAMENTO - CAMPUS SOUSA,CPLAN-SS,DAP-SS,CAMPUS SOUSA,2
"NÚCLEO DE LÍNGUAS, CULTURA E ESTUDOS LINGUÍSTICOS - CAMPUS CG",NUCLI-CG,DG-CG,CAMPUS CAMPINA GRANDE,1
COORDENAÇÃO DE LICITAÇÃO DE OBRAS - REITORIA,CLO-RE,DCCL-RE,REITORIA,1
POLO DE INOVAÇÃO DO IFPB - REITORIA,POLOIFPB-RE,REITORIA,REITORIA,4
COORDENACAO DE PESQUISA E INOVACAO - CAMPUS ITABAIANA,COPI-IB,DG-IB,CAMPUS ITABAIANA,1
COORDENACAO DE EXTENSAO E CULTURA - CAMPUS ITABAIANA,CEXC-IB,DG-IB,CAMPUS ITABAIANA,1
GABINETE MÉDICO - CAMPUS GUARABIRA,GABMED-GB,COPAE-GB,CAMPUS GUARABIRA,1
COORDENACAO DE GESTAO DE PESSOAS E CHEFIA DE GABINETE - CAMPUS ITABAIANA,CGP-IB,DG-IB,CAMPUS ITABAIANA,1
COORDENAÇÃO DE AÇÕES INCLUSIVAS-RE,CAI-RE,PRAE-RE,REITORIA,2
CONTRATOS - CAMPUS GUARABIRA,CONTRATOS-GB,DAPF-GB,CAMPUS GUARABIRA,1
NAPNE - NUCLEO DE ATENDIMENTO AS PESSOAS COM NECESSIDADES EDUC. ESPECÍFICAS - CAMPUS ITABAIANA,NAPNE-IB,CPAE-IB,CAMPUS ITABAIANA,2
NUCLEO LING CULTURA E EST LINGUISTICOS - CAMPUS CABEDELO,NUCLI-CB,DG-CB,CAMPUS CABEDELO,1
NUCLEO DE ASSUNTOS INTERNACIONAIS - CAMPUS CABEDELO,NAI-CB,DG-CB,CAMPUS CABEDELO,1
Assessoria Especial para Inovação e Empreendedorismo-RE,ASSESPIEMP-RE,GAB-RE,REITORIA,1
COORDENAÇÃO DE EXECUÇÃO FINANCEIRA - CAMPUS CATOLÉ DO ROCHA,CEFIN-CR,DAPF-CR,CAMPUS CATOLÉ DO ROCHA,1
COORDENAÇÃO DE PATRIMÔNIO E LOGÍSTICA - CAMPUS CATOLÉ DO ROCHA,CPL-CR,DAPF-CR,CAMPUS CATOLÉ DO ROCHA,1
COORDENACAO GERAL DE ENSINO,CGE-CR,DDE-CR,CAMPUS CATOLÉ DO ROCHA,1
COORD CURSO SUPERIOR DE BACHARELADO EM ENGENHARIA MECÂNICA - CAMPUS JP,CCSBEM-JP,UA3-JP,CAMPUS JOÃO PESSOA,1
COORDENAÇÃO DE AUDIOVISUAL E MULTIMEIOS - CAMPUS JOÃO PESSOA,CAUDIOM-JP,CGDG-JP,CAMPUS JOÃO PESSOA,6
COORD. CURSO TÉCNICO SEGURANÇA NO TRABALHO - CAMPUS PATOS,CTST-PT,DDE-PT,CAMPUS PATOS,3
NÚCLEO DE TECNOLOGIA DA INFORMAÇÃO - CAMPUS ITABAIANA,NTI-IB,DG-IB,CAMPUS ITABAIANA,1
NÚCLEO DE BIBLIOTECA - CAMPUS ITABAIANA,NB-IB,DDE-IB,CAMPUS ITABAIANA,1
